{
  "verse_reference": "PRV 23:29",
  "verse_text": "Verse text for PRV 23:29",
  "scraped_with": "Hybrid approach (Firecrawl + BeautifulSoup)",
  "extraction_date": "2025-09-18",
  "source_url": "https://catenabible.com/prv/23/29",
  "commentary_status": "available",
  "total_commentaries": 6,
  "full_content_fetched": 6,
  "commentaries": [
    {
      "author": "Basil the Great",
      "period": "AD379",
      "content": "“Who has woe? Who has sorrow?” For whom is there distress and darkness? For whom eternal doom? Is it not for the transgressors? For those who deny the faith? And what is the proof of their denial? Is it not that they have denied their own confession? And when and what did they confess? Belief in the Father and in the Son and in the Holy Ghost, when they renounced the devil and his angels and uttered those saving words. What fit title, then, has been discovered for them, for [these former] children of light to use? Are they not addressed as transgressors, as having violated the covenant of their salvation? On the Spirit",
      "commentary_number": "1/6",
      "reading_time": "1 min",
      "source_url": "https://catenabible.com/prv/23/29",
      "full_content_url": "https://catenabible.com/com/5939857985a0ed853b0c8561",
      "content_type": "full",
      "extraction_method": "beautifulsoup"
    },
    {
      "author": "Caesarius of Arles",
      "period": "AD542",
      "content": "1 Esdras Wisdom of Solomon Wisdom of Sirach Epistle of Jeremiah Prayer of Manasseh Who has woe. who has sorrow. who has contentions. who has babbling. who has wounds without cause. who has redness of eyes. Caesarius of Arles People who want to be like this try miserably to excuse themselves. They say, My friend will be unpleasant if I do not give him as much as he wants to drink when I invite him to a banquet. [But I say to you,] Do not have a friend who is willing to make you displeasing to God, for he is both his own enemy and yours. If you make yourself and someone else intoxicated, you will have a man as your friend but God as an enemy.",
      "commentary_number": "2/6",
      "reading_time": "< 1 min",
      "source_url": "https://catenabible.com/prv/23/29",
      "full_content_url": "https://catenabible.com/com/5939857985a0ed853b0c8564",
      "content_type": "full",
      "extraction_method": "beautifulsoup"
    },
    {
      "author": "Caesarius of Arles",
      "period": "AD542",
      "content": "1 Esdras Wisdom of Solomon Wisdom of Sirach Epistle of Jeremiah Prayer of Manasseh Who has woe. who has sorrow. who has contentions. who has babbling. who has wounds without cause. who has redness of eyes. Caesarius of Arles Understand this, brethren, that every drunkard who has made drinking a habit will have leprosy within, in his soul, because the soul of the drunkard is known to be such as the flesh of the leper is seen to be. Therefore one who wishes to free himself of the sin of drunkenness, where not only his soul is killed but even his body is weakened, should drink merely as much as suffices. If he is unwilling to observe this rule, he will be hateful to God and an object of reproach to people.",
      "commentary_number": "3/6",
      "reading_time": "< 1 min",
      "source_url": "https://catenabible.com/prv/23/29",
      "full_content_url": "https://catenabible.com/com/5939857985a0ed853b0c8563",
      "content_type": "full",
      "extraction_method": "beautifulsoup"
    },
    {
      "author": "Clement Of Alexandria",
      "period": "AD215",
      "content": "1 Esdras Wisdom of Solomon Wisdom of Sirach Epistle of Jeremiah Prayer of Manasseh Who has woe. who has sorrow. who has contentions. who has babbling. who has wounds without cause. who has redness of eyes. By the mention of redness of eyes—a sign of death—it is made clear that the winebibber is already dead to the Word and to reason. It declares his death to the Lord. If one forgets the motives that prompt him to seek the true life, he is dragged down to corruption. With good reason, then, the Educator, in his concern for our salvation, sternly forbids us, “Do not drink wine to drunkenness.",
      "commentary_number": "4/6",
      "reading_time": "< 1 min",
      "source_url": "https://catenabible.com/prv/23/29",
      "full_content_url": "https://catenabible.com/com/5939857985a0ed853b0c8560",
      "content_type": "full",
      "extraction_method": "beautifulsoup"
    },
    {
      "author": "George Leo Haydock",
      "period": "AD1849",
      "content": "Work. Revenge is often reprobated, though the law allowed of retaliation, which the more virtuous did not insist upon.",
      "commentary_number": "5/6",
      "reading_time": "< 1 min",
      "source_url": "https://catenabible.com/prv/23/29",
      "full_content_url": "https://catenabible.com/com/5735e1f5ec4bd7c9723be713",
      "content_type": "full",
      "extraction_method": "beautifulsoup"
    },
    {
      "author": "The Apostolic Constitutions",
      "period": "AD375",
      "content": "Since you are the presbyters and deacons of Christ, you ought always to be sober, both among yourselves and among others, so that you may be able to warn the unruly. Now the Scripture says, “The men in power are passionate. But let them not drink wine, lest by drinking they forget wisdom and are not able to judge aright.” Wherefore, [the bishops] and the presbyters and the deacons are those of authority in the church next to God Almighty and his beloved Son, Jesus Christ, and the Holy Spirit. We say this, not that they are not to drink at all, otherwise it would be to the reproach of what God has made for cheerfulness, but that they not be disordered with wine. For the Scripture does not say, “Do not drink wine”; but what says it? “Drink not wine to drunkenness.” .",
      "commentary_number": "6/6",
      "reading_time": "1 min",
      "source_url": "https://catenabible.com/prv/23/29",
      "full_content_url": "https://catenabible.com/com/5939857985a0ed853b0c8562",
      "content_type": "full",
      "extraction_method": "beautifulsoup"
    }
  ],
  "methodology": {
    "step_1": "Parse main page with BeautifulSoup for structure",
    "step_2": "Extract metadata (author, period, reading time)",
    "step_3": "Use Firecrawl to get full content from 'Go to Commentary' links",
    "step_4": "Fallback to BeautifulSoup for accordion content if needed",
    "result": "Successfully captured PRV 23:29",
    "advantages": [
      "Complete commentary content via Firecrawl",
      "Structured metadata extraction",
      "Robust fallback mechanisms",
      "Records verses even without commentaries for complete tracking"
    ]
  }
}