{
  "verse_reference": "JN 11:57",
  "verse_text": "Verse text for JN 11:57",
  "scraped_with": "Hybrid approach (Firecrawl + BeautifulSoup)",
  "extraction_date": "2025-09-11",
  "source_url": "https://catenabible.com/jn/11/57",
  "commentary_status": "available",
  "total_commentaries": 1,
  "full_content_fetched": 1,
  "commentaries": [
    {
      "author": "John Chrysostom",
      "period": "AD407",
      "content": "A marvelous purification, with a murderous will, with homicidal intentions, and bloodstained hands!",
      "commentary_number": "1/1",
      "reading_time": "< 1 min",
      "source_url": "https://catenabible.com/jn/11/57",
      "full_content_url": "https://catenabible.com/com/57eb0a75b0d44ee10cfabbea",
      "content_type": "full",
      "extraction_method": "beautifulsoup"
    }
  ],
  "methodology": {
    "step_1": "Parse main page with BeautifulSoup for structure",
    "step_2": "Extract metadata (author, period, reading time)",
    "step_3": "Use Firecrawl to get full content from 'Go to Commentary' links",
    "step_4": "Fallback to BeautifulSoup for accordion content if needed",
    "result": "Successfully captured JN 11:57",
    "advantages": [
      "Complete commentary content via Firecrawl",
      "Structured metadata extraction",
      "Robust fallback mechanisms",
      "Records verses even without commentaries for complete tracking"
    ]
  }
}