{
  "verse_reference": "PS 102:9",
  "verse_text": "Verse text for PS 102:9",
  "scraped_with": "Hybrid approach (Firecrawl + BeautifulSoup)",
  "extraction_date": "2025-09-17",
  "source_url": "https://catenabible.com/ps/102/9",
  "commentary_status": "available",
  "total_commentaries": 1,
  "full_content_fetched": 1,
  "commentaries": [
    {
      "author": "Augustine of Hippo",
      "period": "AD430",
      "content": "\"I have eaten ashes as it were bread: and mingled my drink with weeping\" (ver. Because He chose to have among His members these kinds of men, that they should be healed and set free, thence is the evil repute. Now at this day what is the character of Pagan calumny against us. what, brethren, do ye conceive they tell us. Ye corrupt discipline, and pervert the morality of the human race. Why dost thou attack us; say why. what have we done. By giving, he replieth, to men room for repentance, by promising impunity for all sins: for this reason men do evil deeds, careless of consequences, because everything is pardoned them, when they are converted. And what is to become of thee, miserable man, if there shall be no harbour of impunity. If there is only licence for sinning, and no pardon for sins, where wilt thou be, whither wilt thou go. Surely even for thee did it happen, that that afflicted one ate ashes as it were bread, and mingled His drink with weeping. Doth not such a feast now please thee. But nevertheless, he replieth, men add to their sins under the hope of pardon. Nay, but they would add to them if they despaired of pardon. Dost thou not observe in what licentious cruelty gladiators live. whence this, except because, as destined for the sword and sacrifice, they choose to sate their lust, before they pour forth their blood. Wouldest not thou also thus address thyself. I am already a sinner, already an unjust man, one already doomed to damnation, hope of pardon there is none: why should I not do whatever pleaseth me, although it be not lawful. why not fulfil, as far as I can, any longings I may have, if, after these, nothing but torments only be in store. Wouldest thou not thus speak unto thyself, and from this very despair become still worse. Rather than this, then, He who promiseth forgiveness, doth correct thee, saying, \"As I live, saith the Lord, I have no pleasure in the death of the wicked; but that the wicked turn from his way and live. For in order that men might not live the worse from despair, He promised a harbour of forgiveness; again, that they might not live the worse from hope of pardon, He made the day of death uncertain: fixing both with the utmost providence, both as a refuge for the returning, and a terror to the loitering. Eat ashes as bread, and mingle thy drink with weeping; by means of this banquet thou shalt reach the table of God. Despair not; pardon hath been promised thee. Thanks be to God, he saith, because it is promised; I hold fast the promise of God. Now therefore live well. To-morrow, he replieth, I will live well. God hath promised the pardon; no one promised thee to-morrow.",
      "commentary_number": "1/1",
      "reading_time": "2 mins",
      "source_url": "https://catenabible.com/ps/102/9",
      "full_content_url": "https://catenabible.com/com/5851ccbf9ac03ecd4b8e64f5",
      "content_type": "full",
      "extraction_method": "firecrawl"
    }
  ],
  "methodology": {
    "step_1": "Parse main page with BeautifulSoup for structure",
    "step_2": "Extract metadata (author, period, reading time)",
    "step_3": "Use Firecrawl to get full content from 'Go to Commentary' links",
    "step_4": "Fallback to BeautifulSoup for accordion content if needed",
    "result": "Successfully captured PS 102:9",
    "advantages": [
      "Complete commentary content via Firecrawl",
      "Structured metadata extraction",
      "Robust fallback mechanisms",
      "Records verses even without commentaries for complete tracking"
    ]
  }
}