{
  "verse_reference": "NM 15:40",
  "verse_text": "Verse text for NM 15:40",
  "scraped_with": "Hybrid approach (Firecrawl + BeautifulSoup)",
  "extraction_date": "2026-03-13",
  "source_url": "https://catenabible.com/nm/15/40",
  "commentary_status": "not_available",
  "total_commentaries": 0,
  "full_content_fetched": 0,
  "commentaries": [],
  "methodology": {
    "step_1": "Parse main page with BeautifulSoup for structure",
    "step_2": "Extract metadata (author, period, reading time)",
    "step_3": "Use Firecrawl to get full content from 'Go to Commentary' links",
    "step_4": "Fallback to BeautifulSoup for accordion content if needed",
    "result": "No commentaries found for NM 15:40",
    "advantages": [
      "Complete commentary content via Firecrawl",
      "Structured metadata extraction",
      "Robust fallback mechanisms",
      "Records verses even without commentaries for complete tracking"
    ]
  }
}