{
  "verse_reference": "IS 17:8",
  "verse_text": "Verse text for IS 17:8",
  "scraped_with": "Hybrid approach (Firecrawl + BeautifulSoup)",
  "extraction_date": "2025-09-18",
  "source_url": "https://catenabible.com/is/17/8",
  "commentary_status": "available",
  "total_commentaries": 2,
  "full_content_fetched": 2,
  "commentaries": [
    {
      "author": "Eusebius of Caesarea",
      "period": "AD339",
      "content": "1 Esdras Wisdom of Solomon Wisdom of Sirach Epistle of Jeremiah Prayer of Manasseh And he shall not look to the altars, the work of his hands, neither shall he respect that which his fingers have made, either the idol poles, or the incense altars. Eusebius of Caesarea By this it is clearly promised that the glory of Israel and all her riches will be taken away, and only a few, who like the few berries on an olive branch can be counted easily, will be left. These are the ones who believe in the Lord. Just after this there is a prophecy of the entire human race turning away from the error of idolatry and recognizing the God of Israel.",
      "commentary_number": "1/2",
      "reading_time": "< 1 min",
      "source_url": "https://catenabible.com/is/17/8",
      "full_content_url": "https://catenabible.com/com/5e4f7f7fc849cf49a740e331",
      "content_type": "full",
      "extraction_method": "beautifulsoup"
    },
    {
      "author": "John of Damascus",
      "period": "AD749",
      "content": "1 Esdras Wisdom of Solomon Wisdom of Sirach Epistle of Jeremiah Prayer of Manasseh And he shall not look to the altars, the work of his hands, neither shall he respect that which his fingers have made, either the idol poles, or the incense altars. John of Damascus Those who trust in idols are foolish. Idols are their own creations, things they made with their own hands, but they turn around and say, “These idols are our creators. ” How can these people say that something they made is their creator. Moreover, they guard their idols, so that they will not be stolen by thieves. What foolishness. If idols cannot guard and protect themselves, how can they guard and save others.",
      "commentary_number": "2/2",
      "reading_time": "< 1 min",
      "source_url": "https://catenabible.com/is/17/8",
      "full_content_url": "https://catenabible.com/com/5e4f7f7fc849cf49a740e332",
      "content_type": "full",
      "extraction_method": "beautifulsoup"
    }
  ],
  "methodology": {
    "step_1": "Parse main page with BeautifulSoup for structure",
    "step_2": "Extract metadata (author, period, reading time)",
    "step_3": "Use Firecrawl to get full content from 'Go to Commentary' links",
    "step_4": "Fallback to BeautifulSoup for accordion content if needed",
    "result": "Successfully captured IS 17:8",
    "advantages": [
      "Complete commentary content via Firecrawl",
      "Structured metadata extraction",
      "Robust fallback mechanisms",
      "Records verses even without commentaries for complete tracking"
    ]
  }
}