{
  "verse_reference": "DN 13:54",
  "verse_text": "Verse text for DN 13:54",
  "scraped_with": "Hybrid approach (Firecrawl + BeautifulSoup)",
  "extraction_date": "2025-09-18",
  "source_url": "https://catenabible.com/dn/13/54",
  "commentary_status": "available",
  "total_commentaries": 2,
  "full_content_fetched": 2,
  "commentaries": [
    {
      "author": "Jerome",
      "period": "AD420",
      "content": "“And a little while after the elder said, ‘Under the mastic tree. ’ And Daniel answered him, ‘You have lied well—but against your own head; here in fact is the angel of God with a sword for cleaving you in two. ’ ” Since the Hebrews do not accept the story of Susanna asserting that it is not contained in the book of Daniel, we must carefully assess if the words schini and prini (which mean mastic tree and evergreen oak) exist in the Jewish language and what their etymology is—if, that is, in their [i. , the Hebrew] language schino derives from the word “to cleave” and prino from the word “to divide” or “to saw. ” If we do not succeed in this attempt, we are necessarily forced to accept those whose position is that this pericope only exists in Greek because it contains etymology that is found only in the Greek and not in the Hebrew. But if someone finds that the words “to cleave” and “to divide” also have the same etymological root as those two trees in the Hebrew, then we will be able to accept this pericope as Scripture as well.",
      "commentary_number": "1/2",
      "reading_time": "1 min",
      "source_url": "https://catenabible.com/dn/13/54",
      "full_content_url": "https://catenabible.com/com/5dc254c81cb33762803d3eed",
      "content_type": "full",
      "extraction_method": "firecrawl"
    },
    {
      "author": "Jerome",
      "period": "AD420",
      "content": "Since the Hebrews reject the story of Susanna, asserting that it is not contained in the Book of Daniel, we ought to investigate carefully the names of the trees, the skhinos and the prinos, which the Latins interpret as \"holm-oak\" and \"mastic-tree,\" and see whether they exist among the Hebrews and what their derivation is ---- for example, as \"cleavage\" [Latin (scissio) is derived from \"mastic\" [Greek skhinos], and \"cutting\" or \"sawing\" [Latin sectio, serratio] is derived from \"holm tree\" [Greek prinos, which resembles the Greek word for \"to saw\": prio] in the language of the Greeks. But if no such derivation can be found, then we too are of necessity forced to agree with the verdict of those who claim that this chapter [Greek pericope] was originally composed in Greek, because it contains Greek etymology not found in Hebrew. [That is, because Daniel twice makes a sinister wordplay based upon the Greek names of these two trees, and a similar pun could not be made out from the Hebrew names, if any, of these trees, the story itself could never have been composed in Hebrew. ] But if anyone can show (A) that the derivation |156 of the ideas of cleaving and severing from the names of the two trees in question is valid in Hebrew, then we may accept this scripture also as canonical.",
      "commentary_number": "2/2",
      "reading_time": "1 min",
      "source_url": "https://catenabible.com/dn/13/54",
      "full_content_url": "https://catenabible.com/com/5743db763c6effa740ddd389",
      "content_type": "full",
      "extraction_method": "firecrawl"
    }
  ],
  "methodology": {
    "step_1": "Parse main page with BeautifulSoup for structure",
    "step_2": "Extract metadata (author, period, reading time)",
    "step_3": "Use Firecrawl to get full content from 'Go to Commentary' links",
    "step_4": "Fallback to BeautifulSoup for accordion content if needed",
    "result": "Successfully captured DN 13:54",
    "advantages": [
      "Complete commentary content via Firecrawl",
      "Structured metadata extraction",
      "Robust fallback mechanisms",
      "Records verses even without commentaries for complete tracking"
    ]
  }
}