{
  "verse_reference": "JGS 11:29",
  "verse_text": "Verse text for JGS 11:29",
  "scraped_with": "Hybrid approach (Firecrawl + BeautifulSoup)",
  "extraction_date": "2026-03-13",
  "source_url": "https://catenabible.com/jgs/11/29",
  "commentary_status": "available",
  "total_commentaries": 1,
  "full_content_fetched": 1,
  "commentaries": [
    {
      "author": "George Leo Haydock",
      "period": "AD1849",
      "content": "Therefore. Hebrew, \"then. \"Septuagint, \"and. \"The refusal of the king of Ammon was not precisely the reason why God endued Jephte with shuch wisdom and courage, though we may say that it was the occasion. (Haydock)\nJephte summoned the troops in Galaad, and in the two tribes of Manasses, to attend his standard. He also invited Ephraim, (chap. xii. 2.; Calmet) and we may reasonably suppose the other tribes also, who were near enough to be ready for the day of battle. Having collected what force he could in so short a time, he returned to Maspha, and thence proceeded to attack the enemy. (Haydock)",
      "commentary_number": "1/1",
      "reading_time": "1 min",
      "source_url": "https://catenabible.com/jgs/11/29",
      "full_content_url": "https://catenabible.com/com/5735e167ec4bd7c9723bcd9b",
      "content_type": "full",
      "extraction_method": "beautifulsoup"
    }
  ],
  "methodology": {
    "step_1": "Parse main page with BeautifulSoup for structure",
    "step_2": "Extract metadata (author, period, reading time)",
    "step_3": "Use Firecrawl to get full content from 'Go to Commentary' links",
    "step_4": "Fallback to BeautifulSoup for accordion content if needed",
    "result": "Successfully captured JGS 11:29",
    "advantages": [
      "Complete commentary content via Firecrawl",
      "Structured metadata extraction",
      "Robust fallback mechanisms",
      "Records verses even without commentaries for complete tracking"
    ]
  }
}