{
  "verse_reference": "IS 2:9",
  "verse_text": "Verse text for IS 2:9",
  "scraped_with": "Hybrid approach (Firecrawl + BeautifulSoup)",
  "extraction_date": "2025-09-18",
  "source_url": "https://catenabible.com/is/2/9",
  "commentary_status": "available",
  "total_commentaries": 1,
  "full_content_fetched": 1,
  "commentaries": [
    {
      "author": "George Leo Haydock",
      "period": "AD1849",
      "content": "Forgive. Septuagint, \"I will not dismiss them. \"Hebrew, \"and thou hast not pardoned them.\"",
      "commentary_number": "1/1",
      "reading_time": "< 1 min",
      "source_url": "https://catenabible.com/is/2/9",
      "full_content_url": "https://catenabible.com/com/5735e257ec4bd7c9723be8ce",
      "content_type": "full",
      "extraction_method": "beautifulsoup"
    }
  ],
  "methodology": {
    "step_1": "Parse main page with BeautifulSoup for structure",
    "step_2": "Extract metadata (author, period, reading time)",
    "step_3": "Use Firecrawl to get full content from 'Go to Commentary' links",
    "step_4": "Fallback to BeautifulSoup for accordion content if needed",
    "result": "Successfully captured IS 2:9",
    "advantages": [
      "Complete commentary content via Firecrawl",
      "Structured metadata extraction",
      "Robust fallback mechanisms",
      "Records verses even without commentaries for complete tracking"
    ]
  }
}