{
  "verse_reference": "JER 8:10",
  "verse_text": "Verse text for JER 8:10",
  "scraped_with": "Hybrid approach (Firecrawl + BeautifulSoup)",
  "extraction_date": "2025-09-18",
  "source_url": "https://catenabible.com/jer/8/10",
  "commentary_status": "available",
  "total_commentaries": 1,
  "full_content_fetched": 1,
  "commentaries": [
    {
      "author": "George Leo Haydock",
      "period": "AD1849",
      "content": "Others. Idumeans Yet most part of the land remained uncultivated. (Calmet)\nThe rest, to ver. 13., \"they will collect their fruits, says\", is supplied by Grabe. (Haydock)",
      "commentary_number": "1/1",
      "reading_time": "< 1 min",
      "source_url": "https://catenabible.com/jer/8/10",
      "full_content_url": "https://catenabible.com/com/5735e264ec4bd7c9723beca1",
      "content_type": "full",
      "extraction_method": "beautifulsoup"
    }
  ],
  "methodology": {
    "step_1": "Parse main page with BeautifulSoup for structure",
    "step_2": "Extract metadata (author, period, reading time)",
    "step_3": "Use Firecrawl to get full content from 'Go to Commentary' links",
    "step_4": "Fallback to BeautifulSoup for accordion content if needed",
    "result": "Successfully captured JER 8:10",
    "advantages": [
      "Complete commentary content via Firecrawl",
      "Structured metadata extraction",
      "Robust fallback mechanisms",
      "Records verses even without commentaries for complete tracking"
    ]
  }
}