{
  "verse_reference": "PS 72:14",
  "verse_text": "Verse text for PS 72:14",
  "scraped_with": "Hybrid approach (Firecrawl + BeautifulSoup)",
  "extraction_date": "2025-09-17",
  "source_url": "https://catenabible.com/ps/72/14",
  "commentary_status": "available",
  "total_commentaries": 2,
  "full_content_fetched": 2,
  "commentaries": [
    {
      "author": "Augustine of Hippo",
      "period": "AD430",
      "content": "\"From usuries and iniquity He shall redeem the souls of them\" (ver. What are these usuries but sins, which are also called debts. But I think they have been called usuries, because more of ill is found in the punishments than hath been committed in the sins. For, for example's sake, while a man-slayer killeth only the body of a man, but can no wise hurt the soul; of himself both soul and body is destroyed in hell. Because of such despisers of present commandment and deriders of future punishment hath been said, \"I coming would have exacted with usuries,\" from these usuries are redeemed the souls of the poor by that blood which hath been shed for the remission of sins. He shall redeem, I say, from usuries, by remitting sins which owed larger punishments: but He shall redeem from iniquity, by helping them by grace even to do righteousness. Therefore the same two things have been repeated which were said above. For in that which is above, \"He shall spare the helpless and poor man,\" there is understood \"from usuries:\" but in that which there he saith, \"and the souls of the poor He shall save;\" there seemeth to have been implied, \"from iniquity:\" so that the words \"He shall redeem,\" are understood with both. So when He shall spare the poor and helpless man, and shall save the souls of the poor: thus \"from usuries and iniquity He shall redeem the souls of them. And honourable shall be the name of Him in the presence of them. \" For they give honour to His name for so great benefits, and they respond that \"meet and right it is\" to render thanks to the Lord their God. Or, as some copies have it, \"and honourable is the name of them in the presence of Him:\" for even if Christians seem despicable to this world, the name of them in the presence of Him is honourable, who to them hath given it, no longer remembering those names in His lips, whereby before they used to be called, when they were bound fast by the superstitions of the Gentiles, or signed with names derived from their own evil deserts, before they were Christians, which name is honourable in the presence of Him, even if it seemeth despicable to enemies.",
      "commentary_number": "1/2",
      "reading_time": "2 mins",
      "source_url": "https://catenabible.com/ps/72/14",
      "full_content_url": "https://catenabible.com/com/5851ccc09ac03ecd4b8e6bd4",
      "content_type": "full",
      "extraction_method": "firecrawl"
    },
    {
      "author": "George Leo Haydock",
      "period": "AD1849",
      "content": "Arabia. Hebrew sheba, ver. 10. (Haydock)\nThis was accomplished by the wise men. (Eusebius)\nFor him, (de ipso.) They shall adopt the form of prayer which he has taught, (St. Augustine) or they shall adore him on his own account. (Berthier)\nThrough him we have access in one spirit to the Father, Ephesians ii. 18., and Romans v. 1. People might pay a civil respect also to Solomon.\nHe shall live. The prolongation of the ruler's life is sometimes (Haydock) a blessing, Proverbs xxviii. 2. The poor shall live, and pay the taxes cheerfully, praying for his prince (Calmet)\nThey shall adore God, and offer their vows for him, (Haydock) as subjects would do for Solomon, and the crowds did for Jesus Christ, crying out, Hosanna, Matthew xxi. (Menochius)",
      "commentary_number": "2/2",
      "reading_time": "1 min",
      "source_url": "https://catenabible.com/ps/72/14",
      "full_content_url": "https://catenabible.com/com/5735e1f4ec4bd7c9723be198",
      "content_type": "full",
      "extraction_method": "beautifulsoup"
    }
  ],
  "methodology": {
    "step_1": "Parse main page with BeautifulSoup for structure",
    "step_2": "Extract metadata (author, period, reading time)",
    "step_3": "Use Firecrawl to get full content from 'Go to Commentary' links",
    "step_4": "Fallback to BeautifulSoup for accordion content if needed",
    "result": "Successfully captured PS 72:14",
    "advantages": [
      "Complete commentary content via Firecrawl",
      "Structured metadata extraction",
      "Robust fallback mechanisms",
      "Records verses even without commentaries for complete tracking"
    ]
  }
}