{
  "verse_reference": "HOS 12:14",
  "verse_text": "Verse text for HOS 12:14",
  "scraped_with": "Hybrid approach (Firecrawl + BeautifulSoup)",
  "extraction_date": "2026-03-13",
  "source_url": "https://catenabible.com/hos/12/14",
  "commentary_status": "available",
  "total_commentaries": 1,
  "full_content_fetched": 1,
  "commentaries": [
    {
      "author": "George Leo Haydock",
      "period": "AD1849",
      "content": "Him. He shall suffer for his crimes. (Menochius)\nHe can blame only himself. (Calmet)",
      "commentary_number": "1/1",
      "reading_time": "< 1 min",
      "source_url": "https://catenabible.com/hos/12/14",
      "full_content_url": "https://catenabible.com/com/5735e2b0ec4bd7c9723bf3c3",
      "content_type": "full",
      "extraction_method": "beautifulsoup"
    }
  ],
  "methodology": {
    "step_1": "Parse main page with BeautifulSoup for structure",
    "step_2": "Extract metadata (author, period, reading time)",
    "step_3": "Use Firecrawl to get full content from 'Go to Commentary' links",
    "step_4": "Fallback to BeautifulSoup for accordion content if needed",
    "result": "Successfully captured HOS 12:14",
    "advantages": [
      "Complete commentary content via Firecrawl",
      "Structured metadata extraction",
      "Robust fallback mechanisms",
      "Records verses even without commentaries for complete tracking"
    ]
  }
}