{
  "verse_reference": "1KGS 12:30",
  "verse_text": "Verse text for 1KGS 12:30",
  "scraped_with": "Hybrid approach (Firecrawl + BeautifulSoup)",
  "extraction_date": "2026-03-13",
  "source_url": "https://catenabible.com/1kgs/12/30",
  "commentary_status": "available",
  "total_commentaries": 2,
  "full_content_fetched": 2,
  "commentaries": [
    {
      "author": "George Leo Haydock",
      "period": "AD1849",
      "content": "1 Esdras Wisdom of Solomon Wisdom of Sirach Epistle of Jeremiah Prayer of Manasseh And this thing became a sin: for the people went to worship before the one, even unto Dan. Sin, almost irreparable, which brought on the ruin of the ten tribes. Though the calves were taken away along with them into captivity, the people did not return to the service of the Lord: but the greatest part imitated the conduct of the pagans, with whom they mixed; while some few returned with the tribe of Juda, and made a part of that kingdom. The Samaritans, who were sent to inhabit their country, were not of the race of Jacob.",
      "commentary_number": "1/2",
      "reading_time": "< 1 min",
      "source_url": "https://catenabible.com/1kgs/12/30",
      "full_content_url": "https://catenabible.com/com/5735e1a2ec4bd7c9723bd319",
      "content_type": "full",
      "extraction_method": "beautifulsoup"
    },
    {
      "author": "Peter Chrysologus",
      "period": "AD450",
      "content": "Now let us talk also about the second kind of scandal, which, we said, arises from human cleverness. … Jeroboam raised up a scandal. He set up as gods for the people, golden calves—pitiful images—to keep them from seeking the living God, the true temple, God’s law, the rightly appointed kings and their ancestral rites. Consequently, the whole people thus delivered over to error became a source of scandal like that given, according to the apostle, when a person eats, as harmless to his own conscience, the flesh of animals that were sacrificed to idols. He thinks that through such conduct he may well bring contempt on the inanimate stones and wooden gods that can neither sanctify nor profane anything. But what he thinks is an example of his faith becomes an occasion of error for uninstructed people, for it leads them not to contempt but to worship, and it causes the meal to appear to be a banquet of religious honor to those very inanimate gods that he is intentionally diminishing by this ridicule. Consequently, the apostle wisely concludes and explains, “And through your ‘knowledge’ the weak one will perish, the brother for whom Christ died.",
      "commentary_number": "2/2",
      "reading_time": "1 min",
      "source_url": "https://catenabible.com/1kgs/12/30",
      "full_content_url": "https://catenabible.com/com/5e1b67d28bc66721fe4ef902",
      "content_type": "full",
      "extraction_method": "firecrawl"
    }
  ],
  "methodology": {
    "step_1": "Parse main page with BeautifulSoup for structure",
    "step_2": "Extract metadata (author, period, reading time)",
    "step_3": "Use Firecrawl to get full content from 'Go to Commentary' links",
    "step_4": "Fallback to BeautifulSoup for accordion content if needed",
    "result": "Successfully captured 1KGS 12:30",
    "advantages": [
      "Complete commentary content via Firecrawl",
      "Structured metadata extraction",
      "Robust fallback mechanisms",
      "Records verses even without commentaries for complete tracking"
    ]
  }
}