{
  "verse_reference": "LK 1:32",
  "verse_text": "Verse text for LK 1:32",
  "scraped_with": "Hybrid approach (Firecrawl + BeautifulSoup)",
  "extraction_date": "2025-09-11",
  "source_url": "https://catenabible.com/lk/1/32",
  "commentary_status": "available",
  "total_commentaries": 3,
  "full_content_fetched": 3,
  "commentaries": [
    {
      "author": "George Leo Haydock",
      "period": "AD1849",
      "content": "He . shall be called; i.e. according to the style of the Scriptures, he shall truly be the Son of God. (Witham)",
      "commentary_number": "1/3",
      "reading_time": "< 1 min",
      "source_url": "https://catenabible.com/lk/1/32",
      "full_content_url": "https://catenabible.com/com/5735e2caec4bd7c9723bf9e1",
      "content_type": "full",
      "extraction_method": "beautifulsoup"
    },
    {
      "author": "Irenaeus of Lyons",
      "period": "AD202",
      "content": "He shall be great, and shall be called the Son of the Highest: and the Lord God shall give unto him the throne of his father David: Irenaeus of Lyons And he says concerning the Lord: \"He shall be great, and shall be called the Son of the Highest: and the Lord God shall give unto Him the throne of His father David: and He shall reign over the house of Jacob for ever; and of His kingdom there shall be no end. And David, knowing by the Spirit the dispensation of the advent of this Person, by which He is supreme over all the living and dead, confessed Him as Lord, sitting on the right hand of the Most High Father.",
      "commentary_number": "2/3",
      "reading_time": "< 1 min",
      "source_url": "https://catenabible.com/lk/1/32",
      "full_content_url": "https://catenabible.com/com/5735e12fec4bd7c9723bbbaa",
      "content_type": "full",
      "extraction_method": "beautifulsoup"
    },
    {
      "author": "Justin Martyr",
      "period": "AD165",
      "content": "And the angel of God who was sent to the same virgin at that time brought her good news, saying, \"Behold, thou shalt conceive of the Holy Spirit, and shalt bear a Son, and He shall be called the Son of the Highest, and thou shalt call His name Jesus; for He shall save His people from their sins\"",
      "commentary_number": "3/3",
      "reading_time": "< 1 min",
      "source_url": "https://catenabible.com/lk/1/32",
      "full_content_url": "https://catenabible.com/com/5735e12fec4bd7c9723bbba9",
      "content_type": "full",
      "extraction_method": "beautifulsoup"
    }
  ],
  "methodology": {
    "step_1": "Parse main page with BeautifulSoup for structure",
    "step_2": "Extract metadata (author, period, reading time)",
    "step_3": "Use Firecrawl to get full content from 'Go to Commentary' links",
    "step_4": "Fallback to BeautifulSoup for accordion content if needed",
    "result": "Successfully captured LK 1:32",
    "advantages": [
      "Complete commentary content via Firecrawl",
      "Structured metadata extraction",
      "Robust fallback mechanisms",
      "Records verses even without commentaries for complete tracking"
    ]
  }
}